{
  "environment": {
    "cpu_model": "Apple M5",
    "filesystem_type": "apfs",
    "htslib_version": "1.23.1",
    "logical_cpu_count": 10,
    "machine": "arm64",
    "operating_system": "Darwin",
    "operating_system_release": "25.5.0",
    "pysam_version": "0.24.0",
    "python_implementation": "CPython",
    "python_version": "3.11.15",
    "source_commit": "d8222f4cd10241de42ec006716234ad6781e4851",
    "temp_monitor_interval_ms": 10,
    "tool_version": "0.1.0.dev6+gfc7ed5871.d20260813",
    "total_memory_bytes": 34359738368
  },
  "inputs": [
    {
      "container": "vcf.gz",
      "deterministic_stats_payload": true,
      "input_bytes": 1087790,
      "input_name": "representative.vcf.gz",
      "measurements": [
        {
          "alleles": 100000,
          "cache_state": "cold_process_uncontrolled_os_cache",
          "contigs": 24,
          "elapsed_ns": 935302792,
          "input_bytes_per_second": 1163035.1254206456,
          "mode": "stats",
          "output_json_bytes": 14297,
          "payload_sha256": "717547db4f7205d245a6ff0429c1df3aa4382bedd88cf53f13c2f2e93f493d94",
          "process_peak_rss_bytes": 63471616,
          "records": 100000,
          "records_per_second": 106917.24739339814,
          "repetition": 1,
          "samples": 1,
          "system_cpu_ns": 40579000,
          "temporary_final_bytes": 0,
          "temporary_peak_bytes": 4820992,
          "threads": 1,
          "user_cpu_ns": 907063000
        },
        {
          "alleles": 100000,
          "cache_state": "warm_process_uncontrolled_os_cache",
          "contigs": 24,
          "elapsed_ns": 936257584,
          "input_bytes_per_second": 1161849.0665278286,
          "mode": "stats",
          "output_json_bytes": 14297,
          "payload_sha256": "717547db4f7205d245a6ff0429c1df3aa4382bedd88cf53f13c2f2e93f493d94",
          "process_peak_rss_bytes": 63471616,
          "records": 100000,
          "records_per_second": 106808.21358238524,
          "repetition": 2,
          "samples": 1,
          "system_cpu_ns": 41650999,
          "temporary_final_bytes": 0,
          "temporary_peak_bytes": 6578176,
          "threads": 1,
          "user_cpu_ns": 900808000
        },
        {
          "alleles": 100000,
          "cache_state": "warm_process_uncontrolled_os_cache",
          "contigs": 24,
          "elapsed_ns": 883319167,
          "input_bytes_per_second": 1231480.127046762,
          "mode": "stats",
          "output_json_bytes": 14297,
          "payload_sha256": "717547db4f7205d245a6ff0429c1df3aa4382bedd88cf53f13c2f2e93f493d94",
          "process_peak_rss_bytes": 63242240,
          "records": 100000,
          "records_per_second": 113209.36274894621,
          "repetition": 1,
          "samples": 1,
          "system_cpu_ns": 33579999,
          "temporary_final_bytes": 0,
          "temporary_peak_bytes": 5734400,
          "threads": 10,
          "user_cpu_ns": 864646001
        },
        {
          "alleles": 100000,
          "cache_state": "warm_process_uncontrolled_os_cache",
          "contigs": 24,
          "elapsed_ns": 910672292,
          "input_bytes_per_second": 1194491.157308649,
          "mode": "stats",
          "output_json_bytes": 14297,
          "payload_sha256": "717547db4f7205d245a6ff0429c1df3aa4382bedd88cf53f13c2f2e93f493d94",
          "process_peak_rss_bytes": 63406080,
          "records": 100000,
          "records_per_second": 109808.98494274162,
          "repetition": 2,
          "samples": 1,
          "system_cpu_ns": 37594999,
          "temporary_final_bytes": 0,
          "temporary_peak_bytes": 6578176,
          "threads": 10,
          "user_cpu_ns": 888941001
        }
      ]
    }
  ],
  "measurement_policy": {
    "baseline": "minimal_sequential_pysam_0.24.0_record_scan",
    "cache": "first-process-cold-label_without_os_cache_eviction_then_warm",
    "clock": "monotonic_wall_clock",
    "memory": "fresh_process_peak_rss_including_native_libraries",
    "paths": "basename_only",
    "temporary_space": "10ms_recursive_size_sampling"
  },
  "receipt_sha256": "1cb55363e9d94bfe1b40017ea8b35fae09d35e205ff3b2412bd2c66f7d8189ae",
  "schema_name": "vcf-sv-stats.streaming-benchmark",
  "schema_version": "1.0.0"
}
