{
  "environment": {
    "cpu_model": "Apple M5",
    "filesystem_type": "apfs",
    "htslib_version": "1.23.1",
    "logical_cpu_count": 10,
    "machine": "arm64",
    "operating_system": "Darwin",
    "operating_system_release": "25.5.0",
    "pysam_version": "0.24.0",
    "python_implementation": "CPython",
    "python_version": "3.11.15",
    "source_commit": "bf97939849291ae362820582946fc9b4080da531",
    "temp_monitor_interval_ms": 10,
    "tool_version": "1.1.0",
    "total_memory_bytes": 34359738368
  },
  "inputs": [
    {
      "container": "vcf.gz",
      "deterministic_stats_payload": true,
      "input_bytes": 5209076,
      "input_name": "one-million.g.vcf.gz",
      "measurements": [
        {
          "alleles": 1000000,
          "cache_state": "cold_process_uncontrolled_os_cache",
          "contigs": 24,
          "elapsed_ns": 4613799958,
          "input_bytes_per_second": 1129020.7740731875,
          "mode": "stats",
          "output_json_bytes": 14139,
          "payload_sha256": "245de0afe684fe2e199886bb1e057be03581d20a79104e944eac89ccc76a14d1",
          "process_peak_rss_bytes": 41238528,
          "records": 1000000,
          "records_per_second": 216741.0830775338,
          "repetition": 1,
          "samples": 1,
          "system_cpu_ns": 414489999,
          "temporary_final_bytes": 0,
          "temporary_peak_bytes": 32768,
          "threads": 1,
          "user_cpu_ns": 4437810000
        },
        {
          "alleles": 1000000,
          "cache_state": "warm_process_uncontrolled_os_cache",
          "contigs": 24,
          "elapsed_ns": 4567147959,
          "input_bytes_per_second": 1140553.3708920071,
          "mode": "stats",
          "output_json_bytes": 14139,
          "payload_sha256": "245de0afe684fe2e199886bb1e057be03581d20a79104e944eac89ccc76a14d1",
          "process_peak_rss_bytes": 41533440,
          "records": 1000000,
          "records_per_second": 218955.02597620134,
          "repetition": 2,
          "samples": 1,
          "system_cpu_ns": 407288000,
          "temporary_final_bytes": 0,
          "temporary_peak_bytes": 32768,
          "threads": 1,
          "user_cpu_ns": 4393488000
        },
        {
          "alleles": 1000000,
          "cache_state": "warm_process_uncontrolled_os_cache",
          "contigs": 24,
          "elapsed_ns": 4547680042,
          "input_bytes_per_second": 1145435.903997575,
          "mode": "stats",
          "output_json_bytes": 14139,
          "payload_sha256": "245de0afe684fe2e199886bb1e057be03581d20a79104e944eac89ccc76a14d1",
          "process_peak_rss_bytes": 44269568,
          "records": 1000000,
          "records_per_second": 219892.33867917745,
          "repetition": 1,
          "samples": 1,
          "system_cpu_ns": 411568999,
          "temporary_final_bytes": 0,
          "temporary_peak_bytes": 32768,
          "threads": 8,
          "user_cpu_ns": 4391804001
        },
        {
          "alleles": 1000000,
          "cache_state": "warm_process_uncontrolled_os_cache",
          "contigs": 24,
          "elapsed_ns": 4635715708,
          "input_bytes_per_second": 1123683.2299725658,
          "mode": "stats",
          "output_json_bytes": 14139,
          "payload_sha256": "245de0afe684fe2e199886bb1e057be03581d20a79104e944eac89ccc76a14d1",
          "process_peak_rss_bytes": 44662784,
          "records": 1000000,
          "records_per_second": 215716.4207188695,
          "repetition": 2,
          "samples": 1,
          "system_cpu_ns": 431241000,
          "temporary_final_bytes": 0,
          "temporary_peak_bytes": 32768,
          "threads": 8,
          "user_cpu_ns": 4461743000
        }
      ]
    }
  ],
  "measurement_policy": {
    "baseline": "minimal_sequential_pysam_0.24.0_record_scan",
    "cache": "first-process-cold-label_without_os_cache_eviction_then_warm",
    "clock": "monotonic_wall_clock",
    "memory": "fresh_process_peak_rss_including_native_libraries",
    "paths": "basename_only",
    "temporary_space": "10ms_recursive_size_sampling"
  },
  "receipt_sha256": "3c14bce41a0e0fcf9dbb81fe35735195178117531ebe0a8fd7283a37e3419674",
  "schema_name": "vcf-sv-stats.streaming-benchmark",
  "schema_version": "1.0.0"
}
